Requirement Location,Feature,Sub Feature,Feature Description,Verification Goal,Pass/Fail Criteria,Test Type,Coverage Method,High Priority?,Link to Coverage,Comment
N/A,Comments,SmepmpOverrule,"""smepmp"" features can overrule the ""privspec"" (e.g. locking). Both specs are included here, so be aware that certain vplan items are conditional.",N/A,N/A,N/A,N/A,No,N/A,
,,FunctionalCoverage,"Functional coverage should capture a broad set of possible state (could be compared with the checkers), to find crosses that this vplan might have overlooked.",N/A,N/A,N/A,N/A,No,N/A,
,,ImplementationChanges,"If test implementation gains new knowledge, then update this vplan when appropriate.",N/A,N/A,N/A,N/A,No,N/A,
,,TimeAllowance,"Some of the verification goals have a ""base level"" of checking plus optional tweaks. It is up to implementation to prioritize and potentially skip the extras.",N/A,N/A,N/A,N/A,No,N/A,
privspec,General,Configs,"The pmp must be tested in a wide range of configurations. That includes testing on both instruction-side and data-side, and it includes testing overlapping regions, non-overlaping, no regions, differing settings for overlapping regions, M-mode only, U-mode only, both M-mode and U-mode, etc, etc. Use functional coverage with plenty of crosses.","Run with different configs to test parameters in low/mid/high ranges and in combination with the other parameters, instantiate checking on both instruction-side and data-side.

Cover: see all relevant region overlap combinations and to see an exhaustive combination of block-level input combinations and functional-level states.",Other,"ENV capability, not specific test",Functional Coverage,No,COV: (SKIPPED),Skipped in favor of using realease-specific configs.
,,Smepmp,"Given 1) backwards-compatible reset values, and 2) no change in ""mseccfg"", then C) the PMP should be fully compatible with the privspec.","For all privspec-derived PMP assertions, check that they must hold as long as the two preconditions hold (i.e. must not be excusable/overridable by smepmp features).",Other,Other,N/A,No,(SKIPPED),Skipped in favor of considering the normal assertions good enough and using release-specific configs.
,,UmodeAlways,"""PMP checks are applied to all accesses whose effective privilege mode is S or U, including instruction fetches in S and U mode, data accesses in S and U mode when the MPRV bit in the mstatus register is clear, and data accesses in any mode when the MPRV bit in mstatus is set and the MPP field in mstatus contains S or U.""

Note: None of those scenarios should let an access bypass the pmp.","Set up the system to match each point in the listing, ensure that the pmp's decision matches all modelled expectations.

Cover: when none of the listed preconditions are active and the pmp's decision can disagree with the modelled expectations.",Assertion Check,Constrained-Random,Functional Coverage,High Priority,"A: uvmt_cv32e40s_tb.dut_wrap.cv32e40s_wrapper_i.rvfi_i.pmprvfi_assert_i.a_noloadstore_*

A: uvmt_cv32e40s_tb.dut_wrap.cv32e40s_wrapper_i.rvfi_i.pmprvfi_assert_i.a_noexec_*

COV: (SKIPPED)","(Same as for ""MmodeDeny"")

Cover is skipped because it is not essential, and we have equivalence checking of RTL vs model."
,,DefaultNone,"""PMP can grant permissions to S and U modes, which by default have none""","Given:
1) out of reset,
2) no extraordinary reset values,
3) no change to the pmp csrs.

Then:
U-mode has no access permissions. (I.e. always excepts.)",Assertion Check,"ENV capability, not specific test",Assertion Coverage,High Priority,"A: (SKIPPED).

DTC: cv32e40s/tests/programs/custom/pmp/","Skipped in favor of using realease-specific configs (which have ""extraordinary reset values"")."
,,DefaultFull,"""can revoke permissions from M-mode, which
by default has full permissions""","Check that, out of reset, given no extraordinary reset values, and given no change to the pmp csrs, then M-mode has full access permissions.",Assertion Check,"ENV capability, not specific test",Assertion Coverage,No,"A: (SKIPPED)

DTC: cv32e40s/tests/programs/custom/pmp/",Skipped in favor of the directed test and the entire test suite in general.
,Csrs,ResetRegisters,"""Writable PMP registers’ A and L fields are set to 0, unless the platform mandates a different reset value for some PMP registers’ A and L fields.""","Read the A and L values right after reset, ensure that the default reset values are 0.

Note: Should also be visible on rvfi without specifically using csr instructions.",Assertion Check,"ENV capability, not specific test",Assertion Coverage,No,"A: (SKIPPED)

DTC: cv32e40s/tests/programs/custom/pmp/","Skipped in favor of integration-level testing w/ release-specific configs, and the directed test."
,,Warl,"""All PMP CSR fields are WARL and may be hardwired to zero"".

Note: A field shall also not change its value when an attempt is made to write an illegal value to it. (XWR is one field.)","Try writing any values to the registers and read values out of them.
Ensure that neither reads nor writes causes exceptions.
And ensure that all read values are legal or otherwise as expected and that illegally written fields don't change.

Cover: access to all CSRs and all fields.",Assertion Check,Constrained-Random,Functional Coverage,No,"A: uvmt_cv32e40s_tb.dut_wrap.cv32e40s_wrapper_i.rvfi_i.pmprvfi_assert_i.gen_cfg_expected[*].a_cfg_expected

A: uvmt_cv32e40s_tb.dut_wrap.cv32e40s_wrapper_i.rvfi_i.pmprvfi_assert_i.gen_cfgwdata_legal[*].a_cfgwdata_legal

A: uvmt_cv32e40s_tb.dut_wrap.cv32e40s_wrapper_i.rvfi_i.pmprvfi_assert_i.gen_cfgrdata_expected[*].a_cfgrdata_expected

COV: (SKIPPED)",Cover skipped because the asserts are deemed sufficient.
,,MmodeOnly,"""PMP CSRs are only accessible to M-mode.""","Try to access any of the pmp CSRs from U-mode, ensure that it always gives ""illegal instruction exception"" and that the CSRs are not updated.

Cover: For all CSRs.

Note: M-mode accesses are covered by AlwaysAccessible below.",Assertion Check,Constrained-Random,Functional Coverage,High Priority,"A: uvmt_cv32e40s_tb.dut_wrap.cv32e40s_wrapper_i.rvfi_i.pmprvfi_assert_i.a_csrs_mmode_only

COV: (SKIPPED)

DTC: cv32e40s/tests/programs/custom/pmp/",Cover skipped because the asserts and directed test are deemed sufficient.
,,Addr34bit,"""Each PMP address register encodes bits 33–2 of a 34-bit physical address for RV32""","Ensure that when the two pmpaddr MSBs are set, then no NAPOT accesses matches.
Ensure that there are no attempted accesses to MSBs that the core should not be able to use.

Cover: all bits have been matched against (""toggle cross"").",Assertion Check,Constrained-Random,Functional Coverage,No,"A: (SKIPPED).

COV: (SKIPPED)",Assert and cover skipped in favor of model equivalence checking.
,,AddrImplemented,"""Not all physical address bits may be implemented, and so the pmpaddr registers are WARL.""","Cover: (toggle) that all bits can be both written and set.

(""UnusedZero"" below covers the WARL(0x0) case.)",Other,Constrained-Random,Functional Coverage,High Priority,COV: (SKIPPED),Skipped in favor of integration-level testing w/ release-specific configs.
,AddressMatching,MatchDisabled,"""When A=0, this PMP entry is disabled and matches no addresses""
When a cfg is set to off but its address(es) (interpreted as napot/tor) is the only rule that matches an attempted access, then it still does not count as a match.","Have a region's address(es) set up as tor and napot (separate runs),
have all other regions not include the target address,
have the target region's rule be OFF,
make an access within that range,
ensure that the outcome is the same as for when an access is outside of all address ranges.

Note: For this and several other items, functional coverage is necessary because the checking doesn't necessarily have the above scenario in its antecedent.

Coverage: Capture the above scenario, minus the checking.",Assertion Check,Constrained-Random,Functional Coverage,No,"A: uvmt_cv32e40s_tb.dut_wrap.cv32e40s_wrapper_i.core_i.*.mpu_i.pmp.pmp_i.u_pmp_assert_lsu.gen_pmp_assert.a_accept_only_legal

A:
uvmt_cv32e40s_tb.dut_wrap.cv32e40s_wrapper_i.core_i.*.mpu_i.pmp.pmp_i.u_pmp_assert_lsu.gen_pmp_assert.a_deny_only_illegal

COV: (SKIPPED)","Cover is skipped in favor of integration-level testing w/ release-specific configs, because we have equivalence checking of RTL vs model."
,,NapotMatching,"""NAPOT ranges make use of the low-order bits of the associated address register to encode the size of the range [""yyyy...yy01"" etc]""

Note: The napot address matching modes match on addresses that are equal to the requested access when masked to the granularity size.","Configure napot rules of different sizes.
Try accesses within and outside the regions.
Ensure that the outcomes corresponds to the designated sizes.

Note: Includes NAPOT and NA4.

Cover: Matching inside / outside.

Cover: Min / Max of the ""yyy..."" patterns.",Assertion Check,Constrained-Random,Functional Coverage,No,"A: uvmt_cv32e40s_tb.dut_wrap.cv32e40s_wrapper_i.core_i.if_stage_i.mpu_i.pmp.pmp_i.u_pmp_assert_if_stage.gen_na4is4byte.a_na4_is_4byte

A: uvmt_cv32e40s_tb.dut_wrap.cv32e40s_wrapper_i.core_i.*.mpu_i.pmp.pmp_i.u_pmp_assert_lsu.gen_pmp_assert.a_accept_only_legal

A: uvmt_cv32e40s_tb.dut_wrap.cv32e40s_wrapper_i.core_i.*.mpu_i.pmp.pmp_i.u_pmp_assert_lsu.gen_pmp_assert.a_deny_only_illegal

COV: dut_wrap.cv32e40s_wrapper_i.core_i.*.mpu_i.pmp.pmp_i.*.gen_cg_common.cover_item_covergroup_cg_internals_common_inst_cg_int_coverpoint_cp_napot_encoding_bin_auto[*]

COV: dut_wrap.cv32e40s_wrapper_i.core_i.*.mpu_i.pmp.pmp_i.*.gen_cg_common.cover_item_covergroup_cg_internals_common_inst_cg_int_coverpoint_cp_napot_encoding_disallowed_bin_auto[*]

COV: (SKIPPED).",Cover skipped (min/max) in favor of model equivalence checking and trusting formal's capability of exercising the asserts.
,,TorMatching,"""If TOR is selected, the associated address register forms the top of the address range, and the preceding PMP address register forms the bottom of the address range. If PMP entry i’s A field is set to TOR, the entry matches any address y such that pmpaddri−1 ≤ y < pmpaddri (irrespective  of the value of pmpcfgi−1)""","Configure tor regions of different sizes.
Try accesses within and outside the regions.
Ensure that the outcomes correspond to the designated ranges.",Assertion Check,Constrained-Random,Functional Coverage,No,"A: uvmt_cv32e40s_tb.dut_wrap.cv32e40s_wrapper_i.core_i.*.mpu_i.pmp.pmp_i.u_pmp_assert_lsu.gen_pmp_assert.a_accept_only_legal

A: uvmt_cv32e40s_tb.dut_wrap.cv32e40s_wrapper_i.core_i.*.mpu_i.pmp.pmp_i.u_pmp_assert_lsu.gen_pmp_assert.a_deny_only_illegal

COV: dut_wrap.cv32e40s_wrapper_i.core_i.*.mpu_i.pmp.pmp_i.*.gen_cg_common.cover_item_covergroup_cg_internals_common_inst_cg_int_coverpoint_cp_ismatch_tor_bin_auto[*]",
,,TorZero,"""If PMP entry 0’s A field is set to TOR, zero is used for the lower bound, and so it matches any address y < pmpaddr0.""","Configure entry 0 as tor regions of different sizes, try accesses within and outside the regions, ensure that the outcomes corresponds to the designated ranges.",Assertion Check,Constrained-Random,Functional Coverage,No,"A: uvmt_cv32e40s_tb.dut_wrap.cv32e40s_wrapper_i.core_i.*.mpu_i.pmp.pmp_i.u_pmp_assert_lsu.gen_pmp_assert.a_accept_only_legal

A: uvmt_cv32e40s_tb.dut_wrap.cv32e40s_wrapper_i.core_i.*.mpu_i.pmp.pmp_i.u_pmp_assert_lsu.gen_pmp_assert.a_deny_only_illegal

COV: (SKIPPED)

DTC: cv32e40s/tests/programs/custom/pmp/",Cover skipped in favor of directed test and equivalence checking vs model.
,,TorNomatch,"""If pmpaddri−1 ≥ pmpaddri and pmpcfgi.A=TOR, then PMP entry i matches no addresses.""","Set up tor regions where the addresses are not in increasing order, try accesses on or within the designated ""reverse"" regions, ensure that they are treated as if there is no match.",Assertion Check,Constrained-Random,Functional Coverage,No,"A: uvmt_cv32e40s_tb.dut_wrap.cv32e40s_wrapper_i.core_i.*.mpu_i.pmp.pmp_i.u_pmp_assert_lsu.gen_pmp_assert.a_accept_only_legal

A: uvmt_cv32e40s_tb.dut_wrap.cv32e40s_wrapper_i.core_i.*.mpu_i.pmp.pmp_i.u_pmp_assert_lsu.gen_pmp_assert.a_deny_only_illegal

COV: (SKIPPED)

DTC: cv32e40s/tests/programs/custom/pmp/",Cover skipped in favor of directed test and equivalence checking vs model.
,,SameGrain,"""In general, the PMP grain [...] must be the same across all PMP regions.""","Do the same as for the basic case of GranularityDetermination below, ensure that all read values are the same across all the pmp csrs.",Assertion Check,"ENV capability, not specific test",Assertion Coverage,No,A: (SKIPPED),Assert skipped in favor of the asserts checking the grain in general and model equivalence checking.
,,Na4Unselectable,"""When G ≥ 1, the NA4 mode is not selectable.""","Have the G parameter set to at least 1, ensure that NA4 never gets selected (even when writing to non-locked cfg).

Note: Formal should easily check this.",Assertion Check,"ENV capability, not specific test",Assertion Coverage,High Priority,"A: uvmt_cv32e40s_tb.dut_wrap.cv32e40s_wrapper_i.core_i.if_stage_i.mpu_i.pmp.pmp_i.u_pmp_assert_if_stage.gen_na4onlyg0[*].a_na4_only_g0
uvmt_cv32e40s_tb.dut_wrap.cv32e40s_wrapper_i.core_i.load_store_unit_i.mpu_i.pmp.pmp_i.u_pmp_assert_lsu.gen_na4onlyg0[*].a_na4_only_g0

A: uvmt_cv32e40s_tb.dut_wrap.cv32e40s_wrapper_i.core_i.if_stage_i.mpu_i.pmp.pmp_i.u_pmp_assert_if_stage.gen_na4onlyg0[*].a_na4_not_when_g uvmt_cv32e40s_tb.dut_wrap.cv32e40s_wrapper_i.core_i.load_store_unit_i.mpu_i.pmp.pmp_i.u_pmp_assert_lsu.gen_na4onlyg0[*].a_na4_not_when_g",
,,NapotImplied,"""When G ≥ 2 and pmpcfgi.A[1] is set, i.e. the mode is NAPOT"".",(Covered by Na4Unselectable above),Other,Other,N/A,High Priority,N/A,
,,NapotOnes,"""When G ≥ 2 and pmpcfgi.A[1] is set, [...] then bits pmpaddri[G-2:0] read as all ones.""","Have the G parameter set to at least 2, have A set, read pmpaddri, ensure the LSBs are all ones as specified.",Assertion Check,Constrained-Random,Assertion Coverage,High Priority,A: uvmt_cv32e40s_tb.dut_wrap.cv32e40s_wrapper_i.rvfi_i.pmprvfi_assert_i.gen_napot_ones_g2.gen_napot_ones_i[*].a_napot_ones,
,,AllZeros,"""When G ≥ 1 and pmpcfgi.A[1] is clear, i.e. the mode is OFF or TOR, then bits pmpaddri[G-1:0] read as all zeros.""","Create the listed preconditions, ensure that the read value contains zeroes as specified.

Note: Check both OFF/TOR, and for all configs fields (checking of all configs don't need 100% coverage in simulation).",Assertion Check,Constrained-Random,Functional Coverage,High Priority,"A: uvmt_cv32e40s_tb.dut_wrap.cv32e40s_wrapper_i.rvfi_i.pmprvfi_assert_i.gen_all_zeros_g1.gen_all_zeros_i[*].a_all_zeros

COV: uvmt_cv32e40s_pmp_assert.sv,  ""cp_ismatch_tor"".

COV: uvmt_cv32e40s_pmp_assert.sv, ""cov_rlb_locked_rules_can_remove"".",(The covers are written for a different purpose but should sufficiently hit this.)
,,TorUnaffected,"""Bits pmpaddri[G-1:0] do not affect the TOR address-matching logic.""","Write different values to ""pmpaddri[G-1:0]"", ensure TOR mode matches the same either way.",Assertion Check,Constrained-Random,Assertion Coverage,No,A: (SKIPPED),Assert skipped in favor of  model equivalence checking.
,,StorageUnaffected,"""Although changing pmpcfgi.A[1] affects the value read from pmpaddri, it does not affect the underlying value stored in that register""
""in particular, pmpaddri[G-1] retains its original value when pmpcfgi.A is changed from NAPOT to TOR/OFF then back to NAPOT.""","Change in and out of (OFF || TOR) and !(OFF || TOR), ensure that different values can be read without having written anything new to the register.

Cover: All transitions, na4/napot -> off/tor.",Assertion Check,Constrained-Random,Functional Coverage,High Priority,"A: uvmt_cv32e40s_tb.dut_wrap.cv32e40s_wrapper_i.rvfi_i.pmprvfi_assert_i.gen_storage_unaffected[*].a_storage_unaffected

COV: (SKIPPED)",Cover skipped because assert is deemed sufficient.
,,GranularityDetermination,"""Software may determine the PMP granularity by writing zero to pmp0cfg, then writing all ones to pmpaddr0, then reading back pmpaddr0. If G is the index of the least-significant bit set, the PMP granularity is 2 G+2 bytes.""","Write zero to pmpicfg, write ones to pmpaddri, read pmpaddri, ensure that the LSB index matches to granularity parameter.

Note: Formal can maybe check this for all i.

Note: If time allows, can write something else than zero and ensure that the rest follows as expected.",Assertion Check,Constrained-Random,Assertion Coverage,High Priority,A: uvmt_cv32e40s_tb.dut_wrap.cv32e40s_wrapper_i.rvfi_i.pmprvfi_assert_i.a_granularity_determination,
,,XlenMatching,"""If the current XLEN is greater than MXLEN, the PMP address registers are zero-extended from MXLEN to XLEN bits for the purposes of address matching.""",N/A,N/A,N/A,N/A,No,N/A,
,LockingAndPrivmode,UntilReset,"""Locked PMP entries remain locked until the hart is reset.""","Lock entry i (for all i, if feasible), ensure that the lock bit is never lifted before reset. (Unless if RLB interferes.)

Note: Sim might do a second reset, formal most likely won't and shouldn't need to.",Assertion Check,Constrained-Random,Assertion Coverage,High Priority,A: uvmt_cv32e40s_tb.dut_wrap.cv32e40s_wrapper_i.rvfi_i.pmprvfi_assert_i.gen_until_reset[*].a_until_reset,
,,IgnoreWrites,"""If PMP entry i is locked, writes to pmpicfg and pmpaddri are ignored.""","Lock entry i (for all i, if feasible), ensure that their value can't change. (Unless if RLB interferes.)

Cover: both when written to and otherwise.",Assertion Check,Constrained-Random,Functional Coverage,High Priority,"A: uvmt_cv32e40s_tb.dut_wrap.cv32e40s_wrapper_i.core_i.if_stage_i.mpu_i.pmp.pmp_i.u_pmp_assert_if_stage.gen_rlb_locked[*].a_norlb_locked_rules_cannot_modify uvmt_cv32e40s_tb.dut_wrap.cv32e40s_wrapper_i.core_i.load_store_unit_i.mpu_i.pmp.pmp_i.u_pmp_assert_lsu.gen_rlb_locked[*].a_norlb_locked_rules_cannot_modify

A: uvmt_cv32e40s_tb.dut_wrap.cv32e40s_wrapper_i.rvfi_i.pmprvfi_assert_i.gen_ignore_writes_notrap[*].a_ignore_writes_notrap

A: uvmt_cv32e40s_tb.dut_wrap.cv32e40s_wrapper_i.rvfi_i.pmprvfi_assert_i.gen_ignore_writes_nochange[*].a_ignore_writes_nochange

COV: (SKIPPED)",Cover skipped because the asserts are deemed sufficient.
,,IgnoreTor,"""Additionally, if PMP entry i is locked and pmpicfg.A is set to TOR, writes to pmpaddri-1 are ignored.""","Lock entry i (…), have A set and the mode be TOR, ensure that pmpaddri-1 can't change. (Unless RLB.)

Cover: both for explicit writes and otherwise",Assertion Check,Constrained-Random,Functional Coverage,High Priority,"A: uvmt_cv32e40s_tb.dut_wrap.cv32e40s_wrapper_i.rvfi_i.pmprvfi_assert_i.gen_ignore_tor[*].a_ignore_tor_stable

A: uvmt_cv32e40s_tb.dut_wrap.cv32e40s_wrapper_i.rvfi_i.pmprvfi_assert_i.gen_ignore_tor[*].a_ignore_tor_wdata

COV: (SKIPPED)",Cover skipped because the asserts are deemed sufficient.
,,NotIgnore,"When neither cfg i is locked, nor is cfg i+1 a locked TOR region, then writes to cfg and addr i are not ignored.","Have cfg i unlocked,
write to cfg and addr csr i,
check that it changes.",Assertion Check,Constrained-Random,Assertion Coverage,High Priority,"A: uvmt_cv32e40s_tb.dut_wrap.cv32e40s_wrapper_i.rvfi_i.pmprvfi_assert_i.gen_addr_writes[*].a_addr_nonlocked

A: uvmt_cv32e40s_tb.dut_wrap.cv32e40s_wrapper_i.rvfi_i.pmprvfi_assert_i.gen_addr_tor[*].a_addr_nonlocked_tor",
,,LockOff,"""Setting the L bit locks the PMP entry even when the A field is set to OFF.""","Lock entry i while the mode is OFF, ensure that it gets locked in this case too.

Note: Ensure that checking and coverage handles locking for all possible modes.",Assertion Check,Constrained-Random,Functional Coverage,High Priority,"A: (Same checking as for ""IgnoreWrites"" and ""IgnoreTor"" above.)

COV: (SKIPPED).","Cover skipped, trusting formal to exercise the assert."
,,RwxPrivmode,"""In addition to locking the PMP entry, the L bit  indicates whether the R/W/X permissions are enforced on M-mode accesses. When the L bit is set, these permissions are enforced for all privilege modes.""","Be in M-mode and U-mode (separate runs),
access a region where L is set and where RWX {grant, deny R, deny W, deny X},
ensure that the access is correspondingly granted/denied.

Cover: grant, deny R, deny W, deny X.",Assertion Check,Constrained-Random,Functional Coverage,High Priority,"A: uvmt_cv32e40s_tb.dut_wrap.cv32e40s_wrapper_i.core_i.*.mpu_i.pmp.pmp_i.u_pmp_assert_lsu.gen_pmp_assert.a_accept_only_legal

A: uvmt_cv32e40s_tb.dut_wrap.cv32e40s_wrapper_i.core_i.*.mpu_i.pmp.pmp_i.u_pmp_assert_lsu.gen_pmp_assert.a_deny_only_illegal

COV: (SKIPPED)",Cover skipped because the asserts are deemed sufficient.
,,MmodeSucceed,"""When the L bit is clear, any M-mode access matching the PMP entry will succeed""","Be in M-mode, access a region where L is clear, ensure that access is granted in all cases.

(Note, see ""Smepmp"" above.)",Assertion Check,Constrained-Random,Assertion Coverage,No,A: (SKIPPED),Assert skipped in favor of Smepmp-based assertions.
,,RwxUmode,"""When the L bit is clear […] the R/W/X permissions apply only to S and U modes.""","Be in U-mode, access a region where L is clear, ensure that access is granted/denied based on RWX.

Cover: granted / denied.

Note: The M-mode part of this is handled by ""MmodeSucceed"" above.",Assertion Check,Constrained-Random,Functional Coverage,High Priority,"A: uvmt_cv32e40s_tb.dut_wrap.cv32e40s_wrapper_i.core_i.if_stage_i.mpu_i.pmp.pmp_i.u_pmp_assert_if_stage.gen_pmp_assert.a_uorl_onlyif_rwx

A: uvmt_cv32e40s_tb.dut_wrap.cv32e40s_wrapper_i.core_i.load_store_unit_i.mpu_i.pmp.pmp_i.u_pmp_assert_lsu.gen_pmp_assert.a_uorl_onlyif_rwx

COV: (SKIPPED)",Cover skipped because the asserts are deemed sufficient.
,PriorityAndMatching,LowestDetermines,"""PMP entries are statically prioritized. The lowest-numbered PMP entry that matches any byte of an access determines whether that access succeeds or fails.""

Note: ""any"" byte.","Access a region that is covered by multiple rules, ensure that the lowest indexed match determines the outcome.

Note: Requires that the rules would disagree on the outcome. (One rule allows, other disallows.)

Cover: ""winning"" rule allows / disallows.",Assertion Check,Constrained-Random,Functional Coverage,High Priority,"A: uvmt_cv32e40s_tb.dut_wrap.cv32e40s_wrapper_i.core_i.*.mpu_i.pmp.pmp_i.u_pmp_assert_lsu.gen_pmp_assert.a_accept_only_legal

A: uvmt_cv32e40s_tb.dut_wrap.cv32e40s_wrapper_i.core_i.*.mpu_i.pmp.pmp_i.u_pmp_assert_lsu.gen_pmp_assert.a_deny_only_illegal

COV: (SKIPPED).","Cover skipped, trusting formal to exercise the assert."
,,MatchAll,"""The matching PMP entry must match all bytes of an access, or the access fails, irrespective of the L, R, W, and X bits.""",(Only relevant for 64-bit architectures.),N/A,N/A,N/A,No,N/A,
,,LrwxDetermines,"""If a PMP entry matches all bytes of an access, then the L, R, W,and X bits determine whether the access succeeds or fails. [...] if the L bit is set or the privilege mode of the access is S or U, then the access succeeds only if the R, W,or X bit corresponding to the access type is set.""","Access a pmp region where L and the privmode etc is such that nothing else would deny the access, ensure that each of (or a combination of) RWX can either grant or deny the access.

Cover: U, M, L, grant, deny R, deny W, deny X, etc.",Assertion Check,Constrained-Random,Functional Coverage,High Priority,"A: uvmt_cv32e40s_tb.dut_wrap.cv32e40s_wrapper_i.core_i.if_stage_i.mpu_i.pmp.pmp_i.u_pmp_assert_if_stage.gen_pmp_assert.a_lrwx_aftermatch

A: uvmt_cv32e40s_tb.dut_wrap.cv32e40s_wrapper_i.core_i.load_store_unit_i.mpu_i.pmp.pmp_i.u_pmp_assert_lsu.gen_pmp_assert.a_lrwx_aftermatch

COV: (SKIPPED)","Cover skipped because the asserts are deemed sufficient. It is partially covered already by the ""general"" covergroup and its crosses."
,,MmodeSucceed2,"""If the L bit is clear and the privilege mode of the access is M, the access succeeds.""","(Same as ""MmodeSucceed"" above)",Other,Other,N/A,No,N/A,
,,MmodeNomatch,"""If no PMP entry matches an M-mode access, the access succeeds.""","Be in M-mode,
access a region where no rule matches,
ensure that the access is granted (where MMWP is off).

Cover: the checker is generic, so cover this specific scenario.

(Note, see ""Smepmp"" above.)",Assertion Check,Constrained-Random,Functional Coverage,High Priority,"A: uvmt_cv32e40s_tb.dut_wrap.cv32e40s_wrapper_i.core_i.*.mpu_i.pmp.pmp_i.u_pmp_assert_lsu.gen_pmp_assert.a_accept_only_legal

COV: uvmt_cv32e40s_pmp_assert.sv, ""cp_x_mmode_nomatch_nommwp_x"".

COV: uvmt_cv32e40s_pmp_assert.sv, ""cp_r_mmode_nomatch_nommwp_r"".

COV: uvmt_cv32e40s_pmp_assert.sv, ""cp_w_mmode_nomatch_nommwp_w"".",
,,UmodeNomatch,"""If no PMP entry matches an S-mode or U-mode access, but at least one PMP entry is implemented, the access fails.""

Note: ""All PMP CSRs are always implemented"".","Be in U-mode, do an access that doesn't match any region, ensure that the access fails.",Assertion Check,Constrained-Random,Assertion Coverage,High Priority,"A: uvmt_cv32e40s_tb.dut_wrap.cv32e40s_wrapper_i.core_i.if_stage_i.mpu_i.pmp.pmp_i.u_pmp_assert_if_stage.gen_pmp_assert.a_nomatch_umode_fails

A: uvmt_cv32e40s_tb.dut_wrap.cv32e40s_wrapper_i.core_i.load_store_unit_i.mpu_i.pmp.pmp_i.u_pmp_assert_lsu.gen_pmp_assert.a_nomatch_umode_fails",
